
*** Running vivado
    with args -log ledyak.vdi -applog -m64 -product Vivado -messageDb vivado.pb -mode batch -source ledyak.tcl -notrace


****** Vivado v2017.4 (64-bit)
  **** SW Build 2086221 on Fri Dec 15 20:55:39 MST 2017
  **** IP Build 2085800 on Fri Dec 15 22:25:07 MST 2017
    ** Copyright 1986-2017 Xilinx, Inc. All Rights Reserved.

source ledyak.tcl -notrace
Command: link_design -top ledyak -part xc7z020clg484-1
Design is defaulting to srcset: sources_1
Design is defaulting to constrset: constrs_1
INFO: [Netlist 29-17] Analyzing 15 Unisim elements for replacement
INFO: [Netlist 29-28] Unisim Transformation completed in 0 CPU seconds
INFO: [Project 1-479] Netlist was created with Vivado 2017.4
INFO: [Device 21-403] Loading part xc7z020clg484-1
INFO: [Project 1-570] Preparing netlist for logic optimization
Parsing XDC File [C:/Users/AEY/Google Drive/01_Github/_Software/_VHDL/A05_LEDYAK/A05_LEDYAK.srcs/constrs_1/new/ledyak_cons.xdc]
WARNING: [Vivado 12-584] No ports matched '[get_ports -of_objects [get_iobanks 35]]'. [C:/Users/AEY/Google Drive/01_Github/_Software/_VHDL/A05_LEDYAK/A05_LEDYAK.srcs/constrs_1/new/ledyak_cons.xdc:372]
CRITICAL WARNING: [Common 17-55] 'set_property' expects at least one object. [C:/Users/AEY/Google Drive/01_Github/_Software/_VHDL/A05_LEDYAK/A05_LEDYAK.srcs/constrs_1/new/ledyak_cons.xdc:372]
Resolution: If [get_<value>] was used to populate the object, check to make sure this command returns at least one valid object.
Finished Parsing XDC File [C:/Users/AEY/Google Drive/01_Github/_Software/_VHDL/A05_LEDYAK/A05_LEDYAK.srcs/constrs_1/new/ledyak_cons.xdc]
INFO: [Opt 31-138] Pushed 0 inverter(s) to 0 load pin(s).
INFO: [Project 1-111] Unisim Transformation Summary:
No Unisim elements were transformed.

7 Infos, 1 Warnings, 1 Critical Warnings and 0 Errors encountered.
link_design completed successfully
link_design: Time (s): cpu = 00:00:14 ; elapsed = 00:00:19 . Memory (MB): peak = 574.457 ; gain = 339.551
Command: opt_design
Attempting to get a license for feature 'Implementation' and/or device 'xc7z020'
INFO: [Common 17-349] Got license for feature 'Implementation' and/or device 'xc7z020'
Running DRC as a precondition to command opt_design

Starting DRC Task
INFO: [DRC 23-27] Running DRC with 2 threads
INFO: [Project 1-461] DRC finished with 0 Errors
INFO: [Project 1-462] Please refer to the DRC report (report_drc) for more information.

Time (s): cpu = 00:00:02 ; elapsed = 00:00:02 . Memory (MB): peak = 586.789 ; gain = 12.332
INFO: [Timing 38-35] Done setting XDC timing constraints.

Starting Logic Optimization Task

Phase 1 Retarget
INFO: [Opt 31-138] Pushed 0 inverter(s) to 0 load pin(s).
INFO: [Opt 31-49] Retargeted 0 cell(s).
Phase 1 Retarget | Checksum: 1715faeaa

Time (s): cpu = 00:00:00 ; elapsed = 00:00:00.049 . Memory (MB): peak = 1142.680 ; gain = 0.000
INFO: [Opt 31-389] Phase Retarget created 0 cells and removed 0 cells

Phase 2 Constant propagation
INFO: [Opt 31-138] Pushed 0 inverter(s) to 0 load pin(s).
Phase 2 Constant propagation | Checksum: 1715faeaa

Time (s): cpu = 00:00:00 ; elapsed = 00:00:00.060 . Memory (MB): peak = 1142.680 ; gain = 0.000
INFO: [Opt 31-389] Phase Constant propagation created 0 cells and removed 0 cells

Phase 3 Sweep
Phase 3 Sweep | Checksum: 1aded8a33

Time (s): cpu = 00:00:00 ; elapsed = 00:00:00.096 . Memory (MB): peak = 1142.680 ; gain = 0.000
INFO: [Opt 31-389] Phase Sweep created 0 cells and removed 0 cells

Phase 4 BUFG optimization
Phase 4 BUFG optimization | Checksum: 1aded8a33

Time (s): cpu = 00:00:00 ; elapsed = 00:00:00.123 . Memory (MB): peak = 1142.680 ; gain = 0.000
INFO: [Opt 31-389] Phase BUFG optimization created 0 cells and removed 0 cells

Phase 5 Shift Register Optimization
Phase 5 Shift Register Optimization | Checksum: 1aded8a33

Time (s): cpu = 00:00:00 ; elapsed = 00:00:00.131 . Memory (MB): peak = 1142.680 ; gain = 0.000
INFO: [Opt 31-389] Phase Shift Register Optimization created 0 cells and removed 0 cells

Starting Connectivity Check Task

Time (s): cpu = 00:00:00 ; elapsed = 00:00:00.002 . Memory (MB): peak = 1142.680 ; gain = 0.000
Ending Logic Optimization Task | Checksum: 1aded8a33

Time (s): cpu = 00:00:00 ; elapsed = 00:00:00.136 . Memory (MB): peak = 1142.680 ; gain = 0.000

Starting Power Optimization Task
INFO: [Pwropt 34-132] Skipping clock gating for clocks with a period < 2.00 ns.
Ending Power Optimization Task | Checksum: 2d1ec4fd8

Time (s): cpu = 00:00:00 ; elapsed = 00:00:00.032 . Memory (MB): peak = 1142.680 ; gain = 0.000
INFO: [Common 17-83] Releasing license: Implementation
22 Infos, 1 Warnings, 1 Critical Warnings and 0 Errors encountered.
opt_design completed successfully
opt_design: Time (s): cpu = 00:00:24 ; elapsed = 00:00:30 . Memory (MB): peak = 1142.680 ; gain = 568.223
Writing placer database...
Writing XDEF routing.
Writing XDEF routing logical nets.
Writing XDEF routing special nets.
Write XDEF Complete: Time (s): cpu = 00:00:01 ; elapsed = 00:00:00.164 . Memory (MB): peak = 1142.680 ; gain = 0.000
INFO: [Common 17-1381] The checkpoint 'C:/Users/AEY/Google Drive/01_Github/_Software/_VHDL/A05_LEDYAK/A05_LEDYAK.runs/impl_1/ledyak_opt.dcp' has been generated.
INFO: [runtcl-4] Executing : report_drc -file ledyak_drc_opted.rpt -pb ledyak_drc_opted.pb -rpx ledyak_drc_opted.rpx
Command: report_drc -file ledyak_drc_opted.rpt -pb ledyak_drc_opted.pb -rpx ledyak_drc_opted.rpx
INFO: [IP_Flow 19-234] Refreshing IP repositories
INFO: [IP_Flow 19-1704] No user IP repositories specified
INFO: [IP_Flow 19-2313] Loaded Vivado IP repository 'C:/Xilinx/Vivado/2017.4/data/ip'.
INFO: [DRC 23-27] Running DRC with 2 threads
INFO: [Coretcl 2-168] The results of DRC are in file C:/Users/AEY/Google Drive/01_Github/_Software/_VHDL/A05_LEDYAK/A05_LEDYAK.runs/impl_1/ledyak_drc_opted.rpt.
report_drc completed successfully
INFO: [Chipscope 16-241] No debug cores found in the current design.
Before running the implement_debug_core command, either use the Set Up Debug wizard (GUI mode)
or use the create_debug_core and connect_debug_core Tcl commands to insert debug cores into the design.
Command: place_design
Attempting to get a license for feature 'Implementation' and/or device 'xc7z020'
INFO: [Common 17-349] Got license for feature 'Implementation' and/or device 'xc7z020'
INFO: [DRC 23-27] Running DRC with 2 threads
INFO: [Vivado_Tcl 4-198] DRC finished with 0 Errors
INFO: [Vivado_Tcl 4-199] Please refer to the DRC report (report_drc) for more information.
Running DRC as a precondition to command place_design
INFO: [DRC 23-27] Running DRC with 2 threads
INFO: [Vivado_Tcl 4-198] DRC finished with 0 Errors
INFO: [Vivado_Tcl 4-199] Please refer to the DRC report (report_drc) for more information.

Starting Placer Task
INFO: [Place 30-611] Multithreading enabled for place_design using a maximum of 2 CPUs

Phase 1 Placer Initialization

Phase 1.1 Placer Initialization Netlist Sorting
Netlist sorting complete. Time (s): cpu = 00:00:00 ; elapsed = 00:00:00 . Memory (MB): peak = 1142.680 ; gain = 0.000
Phase 1.1 Placer Initialization Netlist Sorting | Checksum: 1db09e150

Time (s): cpu = 00:00:01 ; elapsed = 00:00:00.030 . Memory (MB): peak = 1142.680 ; gain = 0.000
INFO: [Timing 38-35] Done setting XDC timing constraints.
INFO: [Opt 31-138] Pushed 0 inverter(s) to 0 load pin(s).
Netlist sorting complete. Time (s): cpu = 00:00:00 ; elapsed = 00:00:00 . Memory (MB): peak = 1142.680 ; gain = 0.000

Phase 1.2 IO Placement/ Clock Placement/ Build Placer Device
INFO: [Timing 38-35] Done setting XDC timing constraints.
Phase 1.2 IO Placement/ Clock Placement/ Build Placer Device | Checksum: 18a404dcb

Time (s): cpu = 00:00:04 ; elapsed = 00:00:02 . Memory (MB): peak = 1142.680 ; gain = 0.000

Phase 1.3 Build Placer Netlist Model
Phase 1.3 Build Placer Netlist Model | Checksum: 1cbbc3306

Time (s): cpu = 00:00:04 ; elapsed = 00:00:03 . Memory (MB): peak = 1142.680 ; gain = 0.000

Phase 1.4 Constrain Clocks/Macros
Phase 1.4 Constrain Clocks/Macros | Checksum: 1cbbc3306

Time (s): cpu = 00:00:04 ; elapsed = 00:00:03 . Memory (MB): peak = 1142.680 ; gain = 0.000
Phase 1 Placer Initialization | Checksum: 1cbbc3306

Time (s): cpu = 00:00:04 ; elapsed = 00:00:03 . Memory (MB): peak = 1142.680 ; gain = 0.000

Phase 2 Global Placement
Phase 2 Global Placement | Checksum: 1e0fcf134

Time (s): cpu = 00:00:06 ; elapsed = 00:00:05 . Memory (MB): peak = 1142.680 ; gain = 0.000

Phase 3 Detail Placement

Phase 3.1 Commit Multi Column Macros
Phase 3.1 Commit Multi Column Macros | Checksum: 1e0fcf134

Time (s): cpu = 00:00:06 ; elapsed = 00:00:05 . Memory (MB): peak = 1142.680 ; gain = 0.000

Phase 3.2 Commit Most Macros & LUTRAMs
Phase 3.2 Commit Most Macros & LUTRAMs | Checksum: 24bf03953

Time (s): cpu = 00:00:06 ; elapsed = 00:00:05 . Memory (MB): peak = 1142.680 ; gain = 0.000

Phase 3.3 Area Swap Optimization
Phase 3.3 Area Swap Optimization | Checksum: 1f02fa336

Time (s): cpu = 00:00:06 ; elapsed = 00:00:05 . Memory (MB): peak = 1142.680 ; gain = 0.000

Phase 3.4 Pipeline Register Optimization
Phase 3.4 Pipeline Register Optimization | Checksum: 1f02fa336

Time (s): cpu = 00:00:06 ; elapsed = 00:00:05 . Memory (MB): peak = 1142.680 ; gain = 0.000

Phase 3.5 Small Shape Detail Placement
Phase 3.5 Small Shape Detail Placement | Checksum: 17dc8857e

Time (s): cpu = 00:00:07 ; elapsed = 00:00:05 . Memory (MB): peak = 1142.680 ; gain = 0.000

Phase 3.6 Re-assign LUT pins
Phase 3.6 Re-assign LUT pins | Checksum: 17dc8857e

Time (s): cpu = 00:00:07 ; elapsed = 00:00:05 . Memory (MB): peak = 1142.680 ; gain = 0.000

Phase 3.7 Pipeline Register Optimization
Phase 3.7 Pipeline Register Optimization | Checksum: 17dc8857e

Time (s): cpu = 00:00:07 ; elapsed = 00:00:05 . Memory (MB): peak = 1142.680 ; gain = 0.000
Phase 3 Detail Placement | Checksum: 17dc8857e

Time (s): cpu = 00:00:07 ; elapsed = 00:00:05 . Memory (MB): peak = 1142.680 ; gain = 0.000

Phase 4 Post Placement Optimization and Clean-Up

Phase 4.1 Post Commit Optimization
Phase 4.1 Post Commit Optimization | Checksum: 17dc8857e

Time (s): cpu = 00:00:07 ; elapsed = 00:00:05 . Memory (MB): peak = 1142.680 ; gain = 0.000

Phase 4.2 Post Placement Cleanup
Phase 4.2 Post Placement Cleanup | Checksum: 17dc8857e

Time (s): cpu = 00:00:07 ; elapsed = 00:00:05 . Memory (MB): peak = 1142.680 ; gain = 0.000

Phase 4.3 Placer Reporting
Phase 4.3 Placer Reporting | Checksum: 17dc8857e

Time (s): cpu = 00:00:07 ; elapsed = 00:00:05 . Memory (MB): peak = 1142.680 ; gain = 0.000

Phase 4.4 Final Placement Cleanup
Phase 4.4 Final Placement Cleanup | Checksum: 176a0b870

Time (s): cpu = 00:00:07 ; elapsed = 00:00:05 . Memory (MB): peak = 1142.680 ; gain = 0.000
Phase 4 Post Placement Optimization and Clean-Up | Checksum: 176a0b870

Time (s): cpu = 00:00:07 ; elapsed = 00:00:05 . Memory (MB): peak = 1142.680 ; gain = 0.000
Ending Placer Task | Checksum: accfa790

Time (s): cpu = 00:00:07 ; elapsed = 00:00:05 . Memory (MB): peak = 1142.680 ; gain = 0.000
INFO: [Common 17-83] Releasing license: Implementation
42 Infos, 1 Warnings, 1 Critical Warnings and 0 Errors encountered.
place_design completed successfully
place_design: Time (s): cpu = 00:00:09 ; elapsed = 00:00:06 . Memory (MB): peak = 1142.680 ; gain = 0.000
Writing placer database...
Writing XDEF routing.
Writing XDEF routing logical nets.
Writing XDEF routing special nets.
Write XDEF Complete: Time (s): cpu = 00:00:00 ; elapsed = 00:00:00.167 . Memory (MB): peak = 1142.680 ; gain = 0.000
INFO: [Common 17-1381] The checkpoint 'C:/Users/AEY/Google Drive/01_Github/_Software/_VHDL/A05_LEDYAK/A05_LEDYAK.runs/impl_1/ledyak_placed.dcp' has been generated.
INFO: [runtcl-4] Executing : report_io -file ledyak_io_placed.rpt
report_io: Time (s): cpu = 00:00:00 ; elapsed = 00:00:00.189 . Memory (MB): peak = 1142.680 ; gain = 0.000
INFO: [runtcl-4] Executing : report_utilization -file ledyak_utilization_placed.rpt -pb ledyak_utilization_placed.pb
report_utilization: Time (s): cpu = 00:00:00 ; elapsed = 00:00:00.118 . Memory (MB): peak = 1142.680 ; gain = 0.000
INFO: [runtcl-4] Executing : report_control_sets -verbose -file ledyak_control_sets_placed.rpt
report_control_sets: Time (s): cpu = 00:00:00 ; elapsed = 00:00:00.013 . Memory (MB): peak = 1142.680 ; gain = 0.000
Command: route_design
Attempting to get a license for feature 'Implementation' and/or device 'xc7z020'
INFO: [Common 17-349] Got license for feature 'Implementation' and/or device 'xc7z020'
Running DRC as a precondition to command route_design
INFO: [DRC 23-27] Running DRC with 2 threads
INFO: [Vivado_Tcl 4-198] DRC finished with 0 Errors
INFO: [Vivado_Tcl 4-199] Please refer to the DRC report (report_drc) for more information.


Starting Routing Task
INFO: [Route 35-254] Multithreading enabled for route_design using a maximum of 2 CPUs
Checksum: PlaceDB: cd9b288 ConstDB: 0 ShapeSum: 9ff5f508 RouteDB: 0

Phase 1 Build RT Design
Phase 1 Build RT Design | Checksum: c68943e3

Time (s): cpu = 00:00:55 ; elapsed = 00:00:49 . Memory (MB): peak = 1266.758 ; gain = 124.078
Post Restoration Checksum: NetGraph: bd25a5ac NumContArr: 9639e37 Constraints: 0 Timing: 0

Phase 2 Router Initialization
INFO: [Route 35-64] No timing constraints were detected. The router will operate in resource-optimization mode.

Phase 2.1 Fix Topology Constraints
Phase 2.1 Fix Topology Constraints | Checksum: c68943e3

Time (s): cpu = 00:00:55 ; elapsed = 00:00:49 . Memory (MB): peak = 1272.977 ; gain = 130.297

Phase 2.2 Pre Route Cleanup
Phase 2.2 Pre Route Cleanup | Checksum: c68943e3

Time (s): cpu = 00:00:55 ; elapsed = 00:00:49 . Memory (MB): peak = 1272.977 ; gain = 130.297
 Number of Nodes with overlaps = 0
Phase 2 Router Initialization | Checksum: 13581489f

Time (s): cpu = 00:00:56 ; elapsed = 00:00:50 . Memory (MB): peak = 1284.867 ; gain = 142.188

Phase 3 Initial Routing
Phase 3 Initial Routing | Checksum: d83b39da

Time (s): cpu = 00:00:56 ; elapsed = 00:00:50 . Memory (MB): peak = 1284.867 ; gain = 142.188

Phase 4 Rip-up And Reroute

Phase 4.1 Global Iteration 0
 Number of Nodes with overlaps = 4
 Number of Nodes with overlaps = 0
Phase 4.1 Global Iteration 0 | Checksum: e4b0ba6a

Time (s): cpu = 00:00:56 ; elapsed = 00:00:50 . Memory (MB): peak = 1284.867 ; gain = 142.188
Phase 4 Rip-up And Reroute | Checksum: e4b0ba6a

Time (s): cpu = 00:00:56 ; elapsed = 00:00:50 . Memory (MB): peak = 1284.867 ; gain = 142.188

Phase 5 Delay and Skew Optimization
Phase 5 Delay and Skew Optimization | Checksum: e4b0ba6a

Time (s): cpu = 00:00:56 ; elapsed = 00:00:50 . Memory (MB): peak = 1284.867 ; gain = 142.188

Phase 6 Post Hold Fix

Phase 6.1 Hold Fix Iter
Phase 6.1 Hold Fix Iter | Checksum: e4b0ba6a

Time (s): cpu = 00:00:56 ; elapsed = 00:00:50 . Memory (MB): peak = 1284.867 ; gain = 142.188
Phase 6 Post Hold Fix | Checksum: e4b0ba6a

Time (s): cpu = 00:00:56 ; elapsed = 00:00:50 . Memory (MB): peak = 1284.867 ; gain = 142.188

Phase 7 Route finalize

Router Utilization Summary
  Global Vertical Routing Utilization    = 0.0098892 %
  Global Horizontal Routing Utilization  = 0.00929682 %
  Routable Net Status*
  *Does not include unroutable nets such as driverless and loadless.
  Run report_route_status for detailed report.
  Number of Failed Nets               = 0
  Number of Unrouted Nets             = 0
  Number of Partially Routed Nets     = 0
  Number of Node Overlaps             = 0

Utilization threshold used for congestion level computation: 0.85
Congestion Report
North Dir 1x1 Area, Max Cong = 17.1171%, No Congested Regions.
South Dir 1x1 Area, Max Cong = 5.40541%, No Congested Regions.
East Dir 1x1 Area, Max Cong = 23.5294%, No Congested Regions.
West Dir 1x1 Area, Max Cong = 8.82353%, No Congested Regions.
Phase 7 Route finalize | Checksum: e4b0ba6a

Time (s): cpu = 00:00:56 ; elapsed = 00:00:50 . Memory (MB): peak = 1284.867 ; gain = 142.188

Phase 8 Verifying routed nets

 Verification completed successfully
Phase 8 Verifying routed nets | Checksum: e4b0ba6a

Time (s): cpu = 00:00:56 ; elapsed = 00:00:50 . Memory (MB): peak = 1284.867 ; gain = 142.188

Phase 9 Depositing Routes
Phase 9 Depositing Routes | Checksum: 7c9eaff3

Time (s): cpu = 00:00:56 ; elapsed = 00:00:50 . Memory (MB): peak = 1284.867 ; gain = 142.188
INFO: [Route 35-16] Router Completed Successfully

Time (s): cpu = 00:00:56 ; elapsed = 00:00:50 . Memory (MB): peak = 1284.867 ; gain = 142.188

Routing Is Done.
INFO: [Common 17-83] Releasing license: Implementation
54 Infos, 1 Warnings, 1 Critical Warnings and 0 Errors encountered.
route_design completed successfully
route_design: Time (s): cpu = 00:01:00 ; elapsed = 00:00:52 . Memory (MB): peak = 1284.867 ; gain = 142.188
Writing placer database...
Writing XDEF routing.
Writing XDEF routing logical nets.
Writing XDEF routing special nets.
Write XDEF Complete: Time (s): cpu = 00:00:01 ; elapsed = 00:00:00.191 . Memory (MB): peak = 1284.867 ; gain = 0.000
INFO: [Common 17-1381] The checkpoint 'C:/Users/AEY/Google Drive/01_Github/_Software/_VHDL/A05_LEDYAK/A05_LEDYAK.runs/impl_1/ledyak_routed.dcp' has been generated.
INFO: [runtcl-4] Executing : report_drc -file ledyak_drc_routed.rpt -pb ledyak_drc_routed.pb -rpx ledyak_drc_routed.rpx
Command: report_drc -file ledyak_drc_routed.rpt -pb ledyak_drc_routed.pb -rpx ledyak_drc_routed.rpx
INFO: [IP_Flow 19-1839] IP Catalog is up to date.
INFO: [DRC 23-27] Running DRC with 2 threads
INFO: [Coretcl 2-168] The results of DRC are in file C:/Users/AEY/Google Drive/01_Github/_Software/_VHDL/A05_LEDYAK/A05_LEDYAK.runs/impl_1/ledyak_drc_routed.rpt.
report_drc completed successfully
INFO: [runtcl-4] Executing : report_methodology -file ledyak_methodology_drc_routed.rpt -pb ledyak_methodology_drc_routed.pb -rpx ledyak_methodology_drc_routed.rpx
Command: report_methodology -file ledyak_methodology_drc_routed.rpt -pb ledyak_methodology_drc_routed.pb -rpx ledyak_methodology_drc_routed.rpx
INFO: [Timing 38-35] Done setting XDC timing constraints.
INFO: [Timing 38-35] Done setting XDC timing constraints.
INFO: [DRC 23-133] Running Methodology with 2 threads
INFO: [Coretcl 2-1520] The results of Report Methodology are in file C:/Users/AEY/Google Drive/01_Github/_Software/_VHDL/A05_LEDYAK/A05_LEDYAK.runs/impl_1/ledyak_methodology_drc_routed.rpt.
report_methodology completed successfully
INFO: [runtcl-4] Executing : report_power -file ledyak_power_routed.rpt -pb ledyak_power_summary_routed.pb -rpx ledyak_power_routed.rpx
Command: report_power -file ledyak_power_routed.rpt -pb ledyak_power_summary_routed.pb -rpx ledyak_power_routed.rpx
WARNING: [Power 33-232] No user defined clocks were found in the design!
Resolution: Please specify clocks using create_clock/create_generated_clock for sequential elements. For pure combinatorial circuits, please specify a virtual clock, otherwise the vectorless estimation might be inaccurate
INFO: [Timing 38-35] Done setting XDC timing constraints.
Running Vector-less Activity Propagation...

Finished Running Vector-less Activity Propagation
66 Infos, 2 Warnings, 1 Critical Warnings and 0 Errors encountered.
report_power completed successfully
INFO: [runtcl-4] Executing : report_route_status -file ledyak_route_status.rpt -pb ledyak_route_status.pb
INFO: [runtcl-4] Executing : report_timing_summary -max_paths 10 -file ledyak_timing_summary_routed.rpt -rpx ledyak_timing_summary_routed.rpx -warn_on_violation 
INFO: [Timing 38-91] UpdateTimingParams: Speed grade: -1, Delay Type: min_max.
INFO: [Timing 38-191] Multithreading enabled for timing update using a maximum of 2 CPUs
WARNING: [Timing 38-313] There are no user specified timing constraints. Timing constraints are needed for proper timing analysis.
INFO: [runtcl-4] Executing : report_incremental_reuse -file ledyak_incremental_reuse_routed.rpt
INFO: [Vivado_Tcl 4-545] No incremental reuse to report, no incremental placement and routing data was found.
INFO: [runtcl-4] Executing : report_clock_utilization -file ledyak_clock_utilization_routed.rpt
INFO: [Common 17-206] Exiting Vivado at Thu Aug  6 16:42:02 2020...

*** Running vivado
    with args -log ledyak.vdi -applog -m64 -product Vivado -messageDb vivado.pb -mode batch -source ledyak.tcl -notrace


****** Vivado v2017.4 (64-bit)
  **** SW Build 2086221 on Fri Dec 15 20:55:39 MST 2017
  **** IP Build 2085800 on Fri Dec 15 22:25:07 MST 2017
    ** Copyright 1986-2017 Xilinx, Inc. All Rights Reserved.

source ledyak.tcl -notrace
Command: open_checkpoint ledyak_routed.dcp

Starting open_checkpoint Task

Time (s): cpu = 00:00:00 ; elapsed = 00:00:00.070 . Memory (MB): peak = 227.109 ; gain = 0.000
INFO: [Netlist 29-17] Analyzing 15 Unisim elements for replacement
INFO: [Netlist 29-28] Unisim Transformation completed in 0 CPU seconds
INFO: [Project 1-479] Netlist was created with Vivado 2017.4
INFO: [Device 21-403] Loading part xc7z020clg484-1
INFO: [Project 1-570] Preparing netlist for logic optimization
Parsing XDC File [C:/Users/AEY/Google Drive/01_Github/_Software/_VHDL/A05_LEDYAK/A05_LEDYAK.runs/impl_1/.Xil/Vivado-1852-DESKTOP-LR8GDO2/dcp1/ledyak.xdc]
Finished Parsing XDC File [C:/Users/AEY/Google Drive/01_Github/_Software/_VHDL/A05_LEDYAK/A05_LEDYAK.runs/impl_1/.Xil/Vivado-1852-DESKTOP-LR8GDO2/dcp1/ledyak.xdc]
Reading XDEF placement.
Reading placer database...
Reading XDEF routing.
Read XDEF File: Time (s): cpu = 00:00:00 ; elapsed = 00:00:00.103 . Memory (MB): peak = 573.133 ; gain = 0.000
Restored from archive | CPU: 0.000000 secs | Memory: 0.000000 MB |
Finished XDEF File Restore: Time (s): cpu = 00:00:00 ; elapsed = 00:00:00.103 . Memory (MB): peak = 573.133 ; gain = 0.000
INFO: [Project 1-111] Unisim Transformation Summary:
No Unisim elements were transformed.

INFO: [Project 1-604] Checkpoint was created with Vivado v2017.4 (64-bit) build 2086221
open_checkpoint: Time (s): cpu = 00:00:12 ; elapsed = 00:00:15 . Memory (MB): peak = 573.133 ; gain = 347.363
Command: write_bitstream -force ledyak.bit -bin_file
Attempting to get a license for feature 'Implementation' and/or device 'xc7z020'
INFO: [Common 17-349] Got license for feature 'Implementation' and/or device 'xc7z020'
Running DRC as a precondition to command write_bitstream
INFO: [IP_Flow 19-234] Refreshing IP repositories
INFO: [IP_Flow 19-1704] No user IP repositories specified
INFO: [IP_Flow 19-2313] Loaded Vivado IP repository 'C:/Xilinx/Vivado/2017.4/data/ip'.
INFO: [DRC 23-27] Running DRC with 2 threads
WARNING: [DRC ZPS7-1] PS7 block required: The PS7 cell must be used in this Zynq design in order to enable correct default configuration.
INFO: [Vivado 12-3199] DRC finished with 0 Errors, 1 Warnings
INFO: [Vivado 12-3200] Please refer to the DRC report (report_drc) for more information.
INFO: [Project 1-821] Please set project.enableDesignId to be 'true'.
INFO: [Designutils 20-2272] Running write_bitstream with 2 threads.
Loading data files...
Loading site data...
Loading route data...
Processing options...
Creating bitmap...
Creating bitstream...
Writing bitstream ./ledyak.bit...
Writing bitstream ./ledyak.bin...
INFO: [Vivado 12-1842] Bitgen Completed Successfully.
INFO: [Project 1-120] WebTalk data collection is mandatory when using a WebPACK part without a full Vivado license. To see the specific WebTalk data collected for your design, open the usage_statistics_webtalk.html or usage_statistics_webtalk.xml file in the implementation directory.
EriŸim engellendi.
EriŸim engellendi.
INFO: [Common 17-83] Releasing license: Implementation
19 Infos, 1 Warnings, 0 Critical Warnings and 0 Errors encountered.
write_bitstream completed successfully
write_bitstream: Time (s): cpu = 00:00:27 ; elapsed = 00:00:25 . Memory (MB): peak = 1047.691 ; gain = 474.559
INFO: [Common 17-206] Exiting Vivado at Thu Aug  6 16:43:22 2020...
